{
  "$schema": "https://json-schema.org/draft/2020-12/schema",
  "$id": "https://github.com/0x63616c/tb4-kvm/design/pcb1a/topology.schema.json",
  "title": "PCB-1A RF-only topology contract",
  "type": "object",
  "additionalProperties": false,
  "required": ["schemaVersion", "status", "orderReady", "claimBoundary", "sourceContracts", "topology", "structureClasses", "pathCampaignRule", "measurementStates", "componentSlots", "controlAndPower", "constraintContract", "reviewInputs"],
  "properties": {
    "schemaVersion": {"const": 1},
    "status": {"const": "PROPOSED"},
    "orderReady": {"const": false},
    "claimBoundary": {
      "type":"object", "additionalProperties":false,
      "required":["purpose","usb4OrThunderboltComplianceClaimAuthorized","containsUsbC","containsCc","containsPd","containsVbus","containsVconn","containsRouter","containsMcu","containsProductPower","prohibitedDomains"],
      "properties": {
        "purpose":{"const":"RF_ONLY_MUX_COUPON"},
        "usb4OrThunderboltComplianceClaimAuthorized":{"const":false},
        "containsUsbC":{"const":false},"containsCc":{"const":false},"containsPd":{"const":false},"containsVbus":{"const":false},"containsVconn":{"const":false},"containsRouter":{"const":false},"containsMcu":{"const":false},"containsProductPower":{"const":false},
        "prohibitedDomains":{"type":"array","minItems":8,"items":{"type":"string","minLength":1}}
      }
    },
    "sourceContracts":{"type":"array","minItems":3,"items":{"type":"object","additionalProperties":false,"required":["id","path","role"],"properties":{"id":{"type":"string","minLength":1},"path":{"type":"string","minLength":1},"role":{"type":"string","minLength":1}}}},
    "topology": {
      "type":"object", "additionalProperties":false, "required":["domain","laneIds","referencePlanes","branches","ports","pathTemplates","paths"],
      "properties": {
        "domain":{"const":"RF_ONLY"},
        "laneIds":{"type":"array","minItems":4,"maxItems":4,"items":{"enum":["D0","D1","D2","D3"]}},
        "referencePlanes":{"type":"array","minItems":2,"maxItems":2,"items":{"type":"object","additionalProperties":false,"required":["id","role","status"],"properties":{"id":{"enum":["CABLE_END","PCB_PACKAGE_LANDS"]},"role":{"enum":["CALIBRATED_RAW","DEEMBEDDED_TARGET"]},"status":{"const":"PROPOSED_UNMEASURED"}}}},
        "branches":{"type":"array","minItems":3,"maxItems":3,"items":{"type":"object","additionalProperties":false,"required":["id","role"],"properties":{"id":{"enum":["HOST_A","COMMON","HOST_B"]},"role":{"type":"string","minLength":1}}}},
        "ports":{"type":"array","minItems":24,"items":{"type":"object","additionalProperties":false,"required":["id","lane","branch","polarity","singleEndedNumber","plane"],"properties":{"id":{"type":"string","minLength":1},"lane":{"enum":["D0","D1","D2","D3"]},"branch":{"enum":["HOST_A","COMMON","HOST_B"]},"polarity":{"enum":["P","N"]},"singleEndedNumber":{"type":"integer","minimum":1,"maximum":24},"plane":{"const":"CABLE_END"}}}},
        "pathTemplates":{"type":"object","additionalProperties":false,"required":["hostToCommon","hostBranchIsolation"],"properties":{"hostToCommon":{"type":"array","minItems":1,"items":{"type":"string","minLength":1}},"hostBranchIsolation":{"type":"object","additionalProperties":false,"required":["directHostAToHostBNetAllowed","inactiveBranchTerminationRequired","allowedInactiveTerminationKinds"],"properties":{"directHostAToHostBNetAllowed":{"const":false},"inactiveBranchTerminationRequired":{"const":true},"allowedInactiveTerminationKinds":{"type":"array","minItems":2,"maxItems":2,"items":{"enum":["matched_50ohm","open"]}}}}}},
        "paths":{"type":"array","minItems":8,"maxItems":8,"items":{"type":"object","additionalProperties":false,"required":["id","lane","activeBranch","endpointPortIds"],"properties":{"id":{"type":"string","minLength":1},"lane":{"enum":["D0","D1","D2","D3"]},"activeBranch":{"enum":["HOST_A","HOST_B"]},"endpointPortIds":{"type":"array","minItems":4,"maxItems":4,"items":{"type":"string","minLength":1}}}}}
      }
    },
    "structureClasses":{"type":"array","minItems":4,"maxItems":4,"items":{"type":"object","additionalProperties":false,"required":["id","kind","required","instanceRule","requiredVariantAxes","instanceCount","instanceCountStatus","notes"],"properties":{"id":{"enum":["DUT_FIXTURE","PLAIN_NO_MUX_THRU","TWO_X_THRU","INACTIVE_PORT_TERMINATION_FIXTURE"]},"kind":{"enum":["DUT_FIXTURE","PLAIN_THRU_COMPARATOR","2X_THRU","TERMINATION_FIXTURE"]},"required":{"const":true},"instanceRule":{"type":"string","minLength":1},"requiredVariantAxes":{"type":"array","minItems":1,"items":{"type":"string","minLength":1}},"instanceCount":{"const":null},"instanceCountStatus":{"type":"string","minLength":1},"notes":{"type":"string","minLength":1}}}},
    "pathCampaignRule":{"type":"object","additionalProperties":false,"required":["scope","applicableStateIds","measurementPlane","measuredPortRule","stateApplicabilityRule","inactiveBundlePortRule","inactiveBundleTerminationRule","remainingUnmeasuredPortRule","remainingUnmeasuredTerminationKind","expectedMeasuredPortCount","expectedInactiveBundlePortCount","expectedRemainingUnmeasuredPortCount","campaignStatus"],"properties":{"scope":{"const":"ONE_HOST_TO_COMMON_PATH_AT_A_TIME_4_PORT"},"applicableStateIds":{"type":"array","minItems":4,"maxItems":4,"items":{"enum":["A_SELECTED_B_MATCHED","B_SELECTED_A_MATCHED","A_SELECTED_B_OPEN","B_SELECTED_A_OPEN"]}},"measurementPlane":{"const":"CABLE_END"},"measuredPortRule":{"const":"EXACTLY_THE_FOUR_PN_ENDPOINTS_OF_THE_PATH"},"stateApplicabilityRule":{"const":"ONLY_STATES_SELECTING_PATH_ACTIVE_BRANCH"},"inactiveBundlePortRule":{"const":"EXACTLY_THE_EIGHT_STATE_INACTIVE_TERMINATION_PORT_IDS"},"inactiveBundleTerminationRule":{"const":"USE_THE_SELECTED_STATE_INACTIVE_TERMINATION_KIND"},"remainingUnmeasuredPortRule":{"const":"ALL_REMAINING_12_UNMEASURED_CABLE_END_PORTS"},"remainingUnmeasuredTerminationKind":{"const":"matched_50ohm"},"expectedMeasuredPortCount":{"const":4},"expectedInactiveBundlePortCount":{"const":8},"expectedRemainingUnmeasuredPortCount":{"const":12},"campaignStatus":{"const":"PROPOSED_UNBOOKED"}}},
    "measurementStates":{"type":"array","minItems":6,"maxItems":6,"items":{"type":"object","additionalProperties":false,"required":["id","activeBranch","inactiveTermination","powerState","hiZAuthority","controlState"],"properties":{"id":{"enum":["UNPOWERED","POWERED_ALL_PATHS_HIZ","A_SELECTED_B_MATCHED","B_SELECTED_A_MATCHED","A_SELECTED_B_OPEN","B_SELECTED_A_OPEN"]},"activeBranch":{"type":["string","null"]},"inactiveTermination":{"type":"object","additionalProperties":false,"required":["kind","fixtureId","planeId","portIds"],"properties":{"kind":{"enum":["matched_50ohm","open","HiZ","not_applicable"]},"fixtureId":{"type":["string","null"]},"planeId":{"type":["string","null"]},"portIds":{"type":"array","items":{"type":"string","minLength":1}}}},"powerState":{"enum":["powered","unpowered"]},"hiZAuthority":{"enum":["NOT_APPLICABLE","CONDITIONAL_BLOCKED_ON_AUTHORITATIVE_DEVICE_STATE_EVIDENCE"]},"controlState":{"type":"string","minLength":1}}}},
    "componentSlots":{"type":"array","minItems":3,"items":{"type":"object","additionalProperties":false,"required":["id","function","sourceRecord","evidenceState","freezeStatus","footprintStatus","modelStatus","prototypeSourceStatus"],"properties":{"id":{"type":"string","minLength":1},"function":{"type":"string","minLength":1},"candidateMpn":{"type":"string","minLength":1},"candidateMpns":{"type":"array","minItems":1,"items":{"type":"string","minLength":1}},"sourceRecord":{"const":"ISSUE5_PARTS_EVIDENCE"},"evidenceState":{"const":"BLOCKED"},"freezeStatus":{"type":"string","minLength":1},"footprintStatus":{"const":"NOT_FROZEN"},"modelStatus":{"type":"string","minLength":1},"prototypeSourceStatus":{"type":"string","minLength":1}}}},
    "controlAndPower":{"type":"object","additionalProperties":false,"required":["muxSupply","controls","allPathsDisabledByDefault","controlStateMappings","maxUncontrolledCurrentA","currentLimitStatus","powerDomain","noHostPowerPath"],"properties":{"muxSupply":{"type":"object","additionalProperties":false,"required":["net","nominalVoltageV","source","status"],"properties":{"net":{"const":"VCC_MUX"},"nominalVoltageV":{"const":1.8},"source":{"const":"EXTERNAL_CURRENT_LIMITED_BENCH_SUPPLY"},"status":{"const":"PROPOSED"}}},"controls":{"type":"array","minItems":2,"maxItems":2,"items":{"type":"object","additionalProperties":false,"required":["id","safeDefault","source"],"properties":{"id":{"enum":["MUX_ENABLE","MUX_SELECT"]},"safeDefault":{"type":"string","minLength":1},"source":{"const":"EXTERNAL_STATIC_TEST_CONTROL"}}}},"allPathsDisabledByDefault":{"const":true},"controlStateMappings":{"type":"array","minItems":4,"maxItems":4,"items":{"type":"object","additionalProperties":false,"required":["id","muxEnable","muxSelect"],"properties":{"id":{"type":"string","minLength":1},"muxEnable":{"enum":["DISABLED","ENABLED"]},"muxSelect":{"enum":["HOST_A","HOST_B"]}}}},"maxUncontrolledCurrentA":{"const":null},"currentLimitStatus":{"const":"BLOCKED_ON_DEVICE_AND_BENCH_SUPPLY_REVIEW"},"powerDomain":{"const":"RF_DEVICE_BIAS_ONLY"},"noHostPowerPath":{"const":true}}},
    "constraintContract":{"type":"object","additionalProperties":false,"required":["status","stackupSource","traceGeometry","numericChannelLimits","layoutGenerationAuthorized","footprintGenerationAuthorized"],"properties":{"status":{"const":"BLOCKED_ON_ISSUE_5_AND_ISSUE_7"},"stackupSource":{"const":"TBD_FABRICATOR_RESPONSE"},"traceGeometry":{"const":"TBD_AFTER_FABRICATOR_STACKUP"},"numericChannelLimits":{"type":"object","additionalProperties":false},"layoutGenerationAuthorized":{"const":false},"footprintGenerationAuthorized":{"const":false}}},
    "reviewInputs":{"type":"object","additionalProperties":false,"required":["requiredBeforeSchematic","requiredBeforeOrder","notClaimedByThisContract"],"properties":{"requiredBeforeSchematic":{"type":"array","minItems":1,"items":{"type":"string","minLength":1}},"requiredBeforeOrder":{"type":"array","minItems":1,"items":{"type":"string","minLength":1}},"notClaimedByThisContract":{"type":"array","minItems":1,"items":{"type":"string","minLength":1}}}}
  }
}
